<?xml version="1.0" encoding="UTF-8"?>
<Light xmlns:xsi="http://www.w3.org/2001/XMLSchema-instance"
 xsi:noNamespaceSchemaLocation="file:/home/tom/Opendungeons/opendungeons/xsd/LightScheme.xsd">
    <posX>UniqueUnicorn10</posX>
    <posY>UniqueUnicorn11</posY>
    <posZ>UniqueUnicorn12</posZ>
    <Diffuse>
        <Red>UniqueUnicorn13</Red>
        <Green>UniqueUnicorn14</Green>
        <Blue>UniqueUnicorn15</Blue>
    </Diffuse>
    <Specular>
        <Red>UniqueUnicorn16</Red>
        <Green>UniqueUnicorn17</Green>
        <Blue>UniqueUnicorn18</Blue>
    </Specular>
    <Attenuation>
        <Range>UniqueUnicorn19</Range>
        <Const>UniqueUnicorn20</Const>
        <Linear>UniqueUnicorn21</Linear>
        <Quadraple>UniqueUnicorn22</Quadraple>
    </Attenuation>
</Light>
